{
  "schema_version": "0.1.0",
  "job_id": "aaaaaaaa-aaaa-4aaa-8aaa-aaaaaaaaaaaa",
  "idempotency_key": "idem-ai-echo-0001",
  "capability": "ai_echo",
  "status": "completed",
  "output": {
    "normalized_text": "Hello from the synthetic test suite.",
    "character_count": 36,
    "context_item_count": 1
  },
  "model_metadata": {
    "provider": "local",
    "model": "deterministic-echo",
    "model_version": "0.1.0"
  },
  "safety": {
    "decision": "allowed",
    "reasons": []
  },
  "completed_at": "2026-07-31T12:00:02Z",
  "trace_id": "trace-slice1-example-001"
}
