{
  "schema_version": "0.1.0",
  "job_id": "bbbbbbbb-bbbb-4bbb-8bbb-bbbbbbbbbbbb",
  "idempotency_key": "idem-sf-plan-extract-0001",
  "capability": "social_flow_plan_extract",
  "status": "completed",
  "output": {
    "result_type": "plan_candidate",
    "candidate": {
      "activity": "dinner",
      "participant_mentions": [],
      "temporal_expressions": ["next Thursday", "after 6:30"],
      "normalized_time_candidates": [
        {
          "label": "Thursday after 6:30",
          "iso_hint": null,
          "confidence": 0.72
        },
        {
          "label": "Thursday at 7:00 PM",
          "iso_hint": null,
          "confidence": 0.55
        }
      ],
      "location_expression": null,
      "possible_commitments": [],
      "revision_hint": null,
      "missing_information": ["exact_time", "location"],
      "confidence": 0.7,
      "recommended_signal_copy": "Dinner next Thursday may be a plan."
    },
    "evidence": [
      {
        "source_id": "11111111-1111-4111-8111-111111111111",
        "field": "activity",
        "snippet": "dinner next Thursday"
      },
      {
        "source_id": "22222222-2222-4222-8222-222222222222",
        "field": "temporal_expressions",
        "snippet": "free after 6:30"
      }
    ],
    "uncertainty": [
      "Exact time not agreed",
      "Location not specified",
      "This is a possible plan, not a binding event"
    ]
  },
  "model_metadata": {
    "provider": "local",
    "model": "deterministic-plan-extract",
    "model_version": "0.1.0"
  },
  "safety": {
    "decision": "allowed",
    "reasons": []
  },
  "completed_at": "2026-07-31T12:00:02Z",
  "trace_id": "trace-sf1-plan-extract-001"
}
